Measure,Applicable Episodes,provider,benchmark,bic,recommended,user defined
All-Cause Hospital Readmission Measure,All Episodes,56.23,70,90,70,70
Advance Care Plan,All Episodes,47.17,70,90,70,70
Hospital-Level Risk-Standardized Complication Rate (RSCR) Following Elective Primary Total Hip Arthroplasty (THA) and/or Total Knee Arthroplasty (TKA),Major joint replacement of the lower extremity (MJRLE),76.1,70,90,90,90
Excess Days in Acute Care after Hospitalization for Acute Myocardial Infarction (AMI),Acute myocardial infarction,72.24,70,90,90,90
Perioperative Care: Selection of Prophylactic Antibiotic: First or Second Generation Cephalosporin,Major joint replacement of the lower extremity (MJRLE),21.56,70,90,70,70
